{
  "schema": "specnav.verification.attempt.v1",
  "id": "attempt-20260812051352-5cab2463dd9031fd",
  "run_id": "run-20260812051352-5cab2463dd9031fd",
  "change_id": "verification-2-0",
  "case_id": "CASE-01",
  "case_snapshot_hash": "5be49e798f6b94dcb4822a608397cf097a336cc73a319dd69aca25549bc48f5a",
  "kind": "regression",
  "sequence": 3,
  "runner": "command",
  "code_sha": "9f3a55aad3203724e09be437f52a89884077cf6b",
  "test_sha": "f465e6926f580652f06af7542378e9f2a93d9afc97199c9f63a4f10af8a90966",
  "scenario_hash": "90b804d98791b7c93952da373453480cf21a40e4be231462994a341d6007b32f",
  "environment_hash": "b50105a3b291fc6ca6ac5740fa47147c990cd9997a069369154d375e671b9f8c",
  "browser_project": "none",
  "test_data_snapshot": "2166ed9c39fb5016172a7b74d85ef6962631d8b463c9299c6b72d1efbe9b06b0",
  "runtime_version": "2.0.0-alpha.2",
  "kernel_version": "2.0.0-alpha.2",
  "status": "passed",
  "started_at": "2026-08-12T05:13:52.329Z",
  "completed_at": "2026-08-12T05:14:00.533Z",
  "exit_status": 0,
  "parent_attempt_id": "attempt-20260812051236-6d056a51957ea1e9"
}
