{
  "schema": "specnav.verification.attempt.v1",
  "id": "attempt-20260809101033-f415cbe200973058",
  "run_id": "run-20260809101033-f415cbe200973058",
  "change_id": "verification-2-0",
  "case_id": "CASE-02",
  "case_snapshot_hash": "5be49e798f6b94dcb4822a608397cf097a336cc73a319dd69aca25549bc48f5a",
  "kind": "regression",
  "sequence": 3,
  "runner": "command",
  "code_sha": "4801eff2cc9f857eabda46cb0e4f02ce16cc03f0",
  "test_sha": "9ee49d6998eaa16a160437def53b7811374a6cc528bfd027cf96e65865e4bea3",
  "scenario_hash": "5b5a1f2e539dba4bcca627aa3ed6ff08146f5242b254f958315a2bcf67b330ce",
  "environment_hash": "b50105a3b291fc6ca6ac5740fa47147c990cd9997a069369154d375e671b9f8c",
  "browser_project": "none",
  "test_data_snapshot": "fa38ef91644228cd38bdfa4101c3a5f5f5b239f2a8923c1397b71db36d9df735",
  "runtime_version": "2.0.0-alpha.2",
  "kernel_version": "2.0.0-alpha.2",
  "status": "passed",
  "started_at": "2026-08-09T10:10:33.578Z",
  "completed_at": "2026-08-09T10:10:37.875Z",
  "exit_status": 0,
  "parent_attempt_id": "attempt-20260809095902-c73dc3a4c9f5bd41"
}
