{
  "schema": "specnav.verification.attempt.v1",
  "id": "attempt-20260811034457-768c7b688eacccdc",
  "run_id": "run-20260811034457-768c7b688eacccdc",
  "change_id": "verification-2-0",
  "case_id": "CASE-03",
  "case_snapshot_hash": "5be49e798f6b94dcb4822a608397cf097a336cc73a319dd69aca25549bc48f5a",
  "kind": "retest",
  "sequence": 2,
  "runner": "command",
  "code_sha": "44e2c6a0b3066b7589e9d2fd0f4c0ff7a916a8bb",
  "test_sha": "37beb1e7c0b27fb9690bbdf4ae8979945b7e9a6a13c640008a4c607d8d590331",
  "scenario_hash": "8e7047dd6c7368108dae972adc41166db473f0883d2547239555e4710ee7f2f8",
  "environment_hash": "b50105a3b291fc6ca6ac5740fa47147c990cd9997a069369154d375e671b9f8c",
  "browser_project": "none",
  "test_data_snapshot": "2ac84e36c32b1e62a5b419bd091780d43725b2def71a0f2b0c77291ab2ff45af",
  "runtime_version": "2.0.0-alpha.2",
  "kernel_version": "2.0.0-alpha.2",
  "status": "failed",
  "started_at": "2026-08-11T03:44:57.288Z",
  "completed_at": "2026-08-11T03:45:09.950Z",
  "exit_status": 1,
  "parent_attempt_id": "attempt-20260811022747-a6f726be7a86df82"
}
