{
  "schema": "specnav.verification.attempt.v1",
  "id": "attempt-20260809101046-833247a31e6c4f0a",
  "run_id": "run-20260809101046-833247a31e6c4f0a",
  "change_id": "verification-2-0",
  "case_id": "CASE-04",
  "case_snapshot_hash": "5be49e798f6b94dcb4822a608397cf097a336cc73a319dd69aca25549bc48f5a",
  "kind": "regression",
  "sequence": 3,
  "runner": "command",
  "code_sha": "4801eff2cc9f857eabda46cb0e4f02ce16cc03f0",
  "test_sha": "9ee49d6998eaa16a160437def53b7811374a6cc528bfd027cf96e65865e4bea3",
  "scenario_hash": "d2484bce8e1a855857d73923375f45df30d95914d641d0810fd36cc1e5c04509",
  "environment_hash": "b50105a3b291fc6ca6ac5740fa47147c990cd9997a069369154d375e671b9f8c",
  "browser_project": "none",
  "test_data_snapshot": "1b291bd2ba16062a4a35d9d3cdf625c4cfd63c56534591ab6a2f1eeda5aec74a",
  "runtime_version": "2.0.0-alpha.2",
  "kernel_version": "2.0.0-alpha.2",
  "status": "passed",
  "started_at": "2026-08-09T10:10:47.013Z",
  "completed_at": "2026-08-09T10:11:22.594Z",
  "exit_status": 0,
  "parent_attempt_id": "attempt-20260809095902-c73dc3a4c9f5bd41"
}
