{
  "schema": "specnav.verification.attempt.v1",
  "id": "attempt-20260806072342-3bcf781792dc4ce3",
  "run_id": "run-20260806072342-3bcf781792dc4ce3",
  "change_id": "verification-2-0",
  "case_id": "CASE-03",
  "case_snapshot_hash": "5be49e798f6b94dcb4822a608397cf097a336cc73a319dd69aca25549bc48f5a",
  "kind": "retest",
  "sequence": 2,
  "runner": "command",
  "code_sha": "b954d8d6999b59daba1a1e03cd3da0bf9cf398e7",
  "test_sha": "833845b48400f3062528a3927c38eda115a1e44bd29f51063d9ecea50f17d33e",
  "scenario_hash": "8e7047dd6c7368108dae972adc41166db473f0883d2547239555e4710ee7f2f8",
  "environment_hash": "b9d5759954c83e81845db5ed213b7b20daa2a9edbcabb35310e0e2afb2e88629",
  "browser_project": "none",
  "test_data_snapshot": "2ac84e36c32b1e62a5b419bd091780d43725b2def71a0f2b0c77291ab2ff45af",
  "runtime_version": "2.0.0-alpha.1",
  "kernel_version": "2.0.0-alpha.1",
  "status": "passed",
  "started_at": "2026-08-06T07:23:42.579Z",
  "completed_at": "2026-08-06T07:27:21.321Z",
  "exit_status": 0,
  "parent_attempt_id": "attempt-20260806063934-95df9951fe619e21"
}
