{
  "schema": "specnav.verification.attempt.v1",
  "id": "attempt-20260811035937-73e26536e212a5c4",
  "run_id": "run-20260811035937-73e26536e212a5c4",
  "change_id": "verification-2-0",
  "case_id": "CASE-07",
  "case_snapshot_hash": "5be49e798f6b94dcb4822a608397cf097a336cc73a319dd69aca25549bc48f5a",
  "kind": "regression",
  "sequence": 3,
  "runner": "command",
  "code_sha": "118108cc037020fda16878b2a92c4eb907b207fe",
  "test_sha": "b72a6f75e9a4cb4706935d60812a0375db5542d37898726875a4a4cf7f762f1b",
  "scenario_hash": "f4cb442b1ef05dbd7835a69b3056970eb3273d8ce8f74802855058212abf17d7",
  "environment_hash": "b50105a3b291fc6ca6ac5740fa47147c990cd9997a069369154d375e671b9f8c",
  "browser_project": "none",
  "test_data_snapshot": "67aaec2f37b0a5d4bb5bf75d1b1edfdd5156748d0e1c5de41f2edcfa80e31219",
  "runtime_version": "2.0.0-alpha.2",
  "kernel_version": "2.0.0-alpha.2",
  "status": "passed",
  "started_at": "2026-08-11T03:59:37.679Z",
  "completed_at": "2026-08-11T03:59:54.165Z",
  "exit_status": 0,
  "parent_attempt_id": "attempt-20260811035724-cea3ea7ce75abfab"
}
