{
  "schema": "specnav.verification.attempt.v1",
  "id": "attempt-20260811050946-a118ddb7a173df6d",
  "run_id": "run-20260811050946-a118ddb7a173df6d",
  "change_id": "verification-2-0",
  "case_id": "CASE-07",
  "case_snapshot_hash": "5be49e798f6b94dcb4822a608397cf097a336cc73a319dd69aca25549bc48f5a",
  "kind": "regression",
  "sequence": 3,
  "runner": "command",
  "code_sha": "29bd413f06b1989378cb5ae88fbcd101457c086b",
  "test_sha": "2b538baa29378bb226eaab949ab6285059d4e083ff004a1e6bf3ef373b24cb9d",
  "scenario_hash": "f4cb442b1ef05dbd7835a69b3056970eb3273d8ce8f74802855058212abf17d7",
  "environment_hash": "b50105a3b291fc6ca6ac5740fa47147c990cd9997a069369154d375e671b9f8c",
  "browser_project": "none",
  "test_data_snapshot": "67aaec2f37b0a5d4bb5bf75d1b1edfdd5156748d0e1c5de41f2edcfa80e31219",
  "runtime_version": "2.0.0-alpha.2",
  "kernel_version": "2.0.0-alpha.2",
  "status": "failed",
  "started_at": "2026-08-11T05:09:46.327Z",
  "completed_at": "2026-08-11T05:10:02.588Z",
  "exit_status": 1,
  "parent_attempt_id": "attempt-20260811050759-348801b49d969b5c"
}
