{
  "schema": "specnav.verification.attempt.v1",
  "id": "attempt-20260806063848-1784a9a338b3345f",
  "run_id": "run-20260806063848-1784a9a338b3345f",
  "change_id": "verification-2-0",
  "case_id": "CASE-01",
  "case_snapshot_hash": "5be49e798f6b94dcb4822a608397cf097a336cc73a319dd69aca25549bc48f5a",
  "kind": "initial",
  "sequence": 1,
  "runner": "command",
  "code_sha": "3e6cf383481870ab48f1bd864ca0094836187cb7",
  "test_sha": "d66d9e38779bc9216e07353dd04f21718d1421bfb30e6315c3230cbae2dbb739",
  "scenario_hash": "90b804d98791b7c93952da373453480cf21a40e4be231462994a341d6007b32f",
  "environment_hash": "b9d5759954c83e81845db5ed213b7b20daa2a9edbcabb35310e0e2afb2e88629",
  "browser_project": "none",
  "test_data_snapshot": "2166ed9c39fb5016172a7b74d85ef6962631d8b463c9299c6b72d1efbe9b06b0",
  "runtime_version": "2.0.0-alpha.1",
  "kernel_version": "2.0.0-alpha.1",
  "status": "passed",
  "started_at": "2026-08-06T06:38:48.544Z",
  "completed_at": "2026-08-06T06:39:27.056Z",
  "exit_status": 0
}
