{
  "schema": "specnav.verification.attempt.v1",
  "id": "attempt-20260811190445-74810c1f49cc5bc3",
  "run_id": "run-20260811190445-74810c1f49cc5bc3",
  "change_id": "verification-2-0",
  "case_id": "CASE-04",
  "case_snapshot_hash": "5be49e798f6b94dcb4822a608397cf097a336cc73a319dd69aca25549bc48f5a",
  "kind": "regression",
  "sequence": 3,
  "runner": "command",
  "code_sha": "ae982fd5d8ee0b5dde303939760fb9b4cdc41a92",
  "test_sha": "01d0a17d7d8fa80fe5dd56588c4c2a455120e5fc3ea444be47b3fb07938cc8b7",
  "scenario_hash": "d2484bce8e1a855857d73923375f45df30d95914d641d0810fd36cc1e5c04509",
  "environment_hash": "b50105a3b291fc6ca6ac5740fa47147c990cd9997a069369154d375e671b9f8c",
  "browser_project": "none",
  "test_data_snapshot": "1b291bd2ba16062a4a35d9d3cdf625c4cfd63c56534591ab6a2f1eeda5aec74a",
  "runtime_version": "2.0.0-alpha.2",
  "kernel_version": "2.0.0-alpha.2",
  "status": "passed",
  "started_at": "2026-08-11T19:04:45.627Z",
  "completed_at": "2026-08-11T19:04:56.636Z",
  "exit_status": 0,
  "parent_attempt_id": "attempt-20260811185727-fe838f72ef8f6909"
}
