{
  "schema": "specnav.verification.attempt.v1",
  "id": "attempt-20260811022742-c6c9d2917ef1e1c0",
  "run_id": "run-20260811022742-c6c9d2917ef1e1c0",
  "change_id": "verification-2-0",
  "case_id": "CASE-02",
  "case_snapshot_hash": "5be49e798f6b94dcb4822a608397cf097a336cc73a319dd69aca25549bc48f5a",
  "kind": "initial",
  "sequence": 1,
  "runner": "command",
  "code_sha": "9e802318a479d2812aec3407b081502112e1111f",
  "test_sha": "04655f61789bc58af48602a6f423cb44a48c2985df9d03c223e243d8244c87ad",
  "scenario_hash": "5b5a1f2e539dba4bcca627aa3ed6ff08146f5242b254f958315a2bcf67b330ce",
  "environment_hash": "b50105a3b291fc6ca6ac5740fa47147c990cd9997a069369154d375e671b9f8c",
  "browser_project": "none",
  "test_data_snapshot": "fa38ef91644228cd38bdfa4101c3a5f5f5b239f2a8923c1397b71db36d9df735",
  "runtime_version": "2.0.0-alpha.2",
  "kernel_version": "2.0.0-alpha.2",
  "status": "passed",
  "started_at": "2026-08-11T02:27:42.690Z",
  "completed_at": "2026-08-11T02:27:47.167Z",
  "exit_status": 0
}
