{
  "schema": "specnav.verification.attempt.v1",
  "id": "attempt-20260811075800-6f92ef4bc4b2d5b9",
  "run_id": "run-20260811075800-6f92ef4bc4b2d5b9",
  "change_id": "verification-2-0",
  "case_id": "CASE-08",
  "case_snapshot_hash": "5be49e798f6b94dcb4822a608397cf097a336cc73a319dd69aca25549bc48f5a",
  "kind": "initial",
  "sequence": 1,
  "runner": "command",
  "code_sha": "4ec73eca413718a68c6400bfb88218d4927354a6",
  "test_sha": "80351dad8179007d57f161e047afbf09d6f7c83e3ef9e9825c517d9ed8100f3d",
  "scenario_hash": "49a621bc1d798d2b74d3973d703643f0f4fa0cf08337a51dda19a4cbbdbf0e7a",
  "environment_hash": "b50105a3b291fc6ca6ac5740fa47147c990cd9997a069369154d375e671b9f8c",
  "browser_project": "none",
  "test_data_snapshot": "6482f82bc1bedc3583362c7512b13616cc9165039b4d45188590e8c1822abb23",
  "runtime_version": "2.0.0-alpha.2",
  "kernel_version": "2.0.0-alpha.2",
  "status": "failed",
  "started_at": "2026-08-11T07:58:00.114Z",
  "completed_at": "2026-08-11T08:17:03.209Z",
  "exit_status": null
}
