{
  "schema": "specnav.verification.attempt.v1",
  "id": "attempt-20260809101213-1870b06e98c0c70e",
  "run_id": "run-20260809101213-1870b06e98c0c70e",
  "change_id": "verification-2-0",
  "case_id": "CASE-06",
  "case_snapshot_hash": "5be49e798f6b94dcb4822a608397cf097a336cc73a319dd69aca25549bc48f5a",
  "kind": "regression",
  "sequence": 3,
  "runner": "command",
  "code_sha": "4801eff2cc9f857eabda46cb0e4f02ce16cc03f0",
  "test_sha": "9ee49d6998eaa16a160437def53b7811374a6cc528bfd027cf96e65865e4bea3",
  "scenario_hash": "09cefc234a66db0baebb746678da9b940b28d08b193915c0fd90768ba8ecf2cc",
  "environment_hash": "b50105a3b291fc6ca6ac5740fa47147c990cd9997a069369154d375e671b9f8c",
  "browser_project": "none",
  "test_data_snapshot": "3c3a783b064ce9d806646d53e0708f8df4f1601bb59210047dc2ce56f7e87c78",
  "runtime_version": "2.0.0-alpha.2",
  "kernel_version": "2.0.0-alpha.2",
  "status": "passed",
  "started_at": "2026-08-09T10:12:14.033Z",
  "completed_at": "2026-08-09T10:12:29.113Z",
  "exit_status": 0,
  "parent_attempt_id": "attempt-20260809095902-c73dc3a4c9f5bd41"
}
