{
  "schema": "specnav.verification.attempt.v1",
  "id": "attempt-20260806063927-5ba14e6777c3fe97",
  "run_id": "run-20260806063927-5ba14e6777c3fe97",
  "change_id": "verification-2-0",
  "case_id": "CASE-02",
  "case_snapshot_hash": "5be49e798f6b94dcb4822a608397cf097a336cc73a319dd69aca25549bc48f5a",
  "kind": "initial",
  "sequence": 1,
  "runner": "command",
  "code_sha": "3e6cf383481870ab48f1bd864ca0094836187cb7",
  "test_sha": "d66d9e38779bc9216e07353dd04f21718d1421bfb30e6315c3230cbae2dbb739",
  "scenario_hash": "5b5a1f2e539dba4bcca627aa3ed6ff08146f5242b254f958315a2bcf67b330ce",
  "environment_hash": "b9d5759954c83e81845db5ed213b7b20daa2a9edbcabb35310e0e2afb2e88629",
  "browser_project": "none",
  "test_data_snapshot": "fa38ef91644228cd38bdfa4101c3a5f5f5b239f2a8923c1397b71db36d9df735",
  "runtime_version": "2.0.0-alpha.1",
  "kernel_version": "2.0.0-alpha.1",
  "status": "passed",
  "started_at": "2026-08-06T06:39:27.604Z",
  "completed_at": "2026-08-06T06:39:33.213Z",
  "exit_status": 0
}
