{
  "schema": "specnav.verification.attempt.v1",
  "id": "attempt-20260811024507-a9743b9c2f07cdd8",
  "run_id": "run-20260811024507-a9743b9c2f07cdd8",
  "change_id": "verification-2-0",
  "case_id": "CASE-06",
  "case_snapshot_hash": "5be49e798f6b94dcb4822a608397cf097a336cc73a319dd69aca25549bc48f5a",
  "kind": "initial",
  "sequence": 1,
  "runner": "command",
  "code_sha": "9e802318a479d2812aec3407b081502112e1111f",
  "test_sha": "04655f61789bc58af48602a6f423cb44a48c2985df9d03c223e243d8244c87ad",
  "scenario_hash": "09cefc234a66db0baebb746678da9b940b28d08b193915c0fd90768ba8ecf2cc",
  "environment_hash": "b50105a3b291fc6ca6ac5740fa47147c990cd9997a069369154d375e671b9f8c",
  "browser_project": "none",
  "test_data_snapshot": "3c3a783b064ce9d806646d53e0708f8df4f1601bb59210047dc2ce56f7e87c78",
  "runtime_version": "2.0.0-alpha.2",
  "kernel_version": "2.0.0-alpha.2",
  "status": "passed",
  "started_at": "2026-08-11T02:45:07.681Z",
  "completed_at": "2026-08-11T02:45:14.831Z",
  "exit_status": 0
}
