{
  "schema": "specnav.verification.attempt.v1",
  "id": "attempt-20260811022747-a6f726be7a86df82",
  "run_id": "run-20260811022747-a6f726be7a86df82",
  "change_id": "verification-2-0",
  "case_id": "CASE-03",
  "case_snapshot_hash": "5be49e798f6b94dcb4822a608397cf097a336cc73a319dd69aca25549bc48f5a",
  "kind": "initial",
  "sequence": 1,
  "runner": "command",
  "code_sha": "9e802318a479d2812aec3407b081502112e1111f",
  "test_sha": "04655f61789bc58af48602a6f423cb44a48c2985df9d03c223e243d8244c87ad",
  "scenario_hash": "8e7047dd6c7368108dae972adc41166db473f0883d2547239555e4710ee7f2f8",
  "environment_hash": "b50105a3b291fc6ca6ac5740fa47147c990cd9997a069369154d375e671b9f8c",
  "browser_project": "none",
  "test_data_snapshot": "2ac84e36c32b1e62a5b419bd091780d43725b2def71a0f2b0c77291ab2ff45af",
  "runtime_version": "2.0.0-alpha.2",
  "kernel_version": "2.0.0-alpha.2",
  "status": "failed",
  "started_at": "2026-08-11T02:27:47.513Z",
  "completed_at": "2026-08-11T02:43:39.868Z",
  "exit_status": null
}
