{
  "schema": "specnav.verification.attempt.v1",
  "id": "attempt-20260806064254-74e81b58046844e6",
  "run_id": "run-20260806064254-74e81b58046844e6",
  "change_id": "verification-2-0",
  "case_id": "CASE-04",
  "case_snapshot_hash": "5be49e798f6b94dcb4822a608397cf097a336cc73a319dd69aca25549bc48f5a",
  "kind": "initial",
  "sequence": 1,
  "runner": "command",
  "code_sha": "3e6cf383481870ab48f1bd864ca0094836187cb7",
  "test_sha": "d66d9e38779bc9216e07353dd04f21718d1421bfb30e6315c3230cbae2dbb739",
  "scenario_hash": "d2484bce8e1a855857d73923375f45df30d95914d641d0810fd36cc1e5c04509",
  "environment_hash": "b9d5759954c83e81845db5ed213b7b20daa2a9edbcabb35310e0e2afb2e88629",
  "browser_project": "none",
  "test_data_snapshot": "1b291bd2ba16062a4a35d9d3cdf625c4cfd63c56534591ab6a2f1eeda5aec74a",
  "runtime_version": "2.0.0-alpha.1",
  "kernel_version": "2.0.0-alpha.1",
  "status": "passed",
  "started_at": "2026-08-06T06:42:54.435Z",
  "completed_at": "2026-08-06T06:43:04.540Z",
  "exit_status": 0
}
