{
  "schema": "specnav.verification.attempt.v1",
  "id": "attempt-20260811050927-1d6803c3c76e9f73",
  "run_id": "run-20260811050927-1d6803c3c76e9f73",
  "change_id": "verification-2-0",
  "case_id": "CASE-05",
  "case_snapshot_hash": "5be49e798f6b94dcb4822a608397cf097a336cc73a319dd69aca25549bc48f5a",
  "kind": "regression",
  "sequence": 3,
  "runner": "command",
  "code_sha": "29bd413f06b1989378cb5ae88fbcd101457c086b",
  "test_sha": "2b538baa29378bb226eaab949ab6285059d4e083ff004a1e6bf3ef373b24cb9d",
  "scenario_hash": "beefb030833c846a6c7ec39354b360f9222e5d742746082f8050a707c2bac11a",
  "environment_hash": "b50105a3b291fc6ca6ac5740fa47147c990cd9997a069369154d375e671b9f8c",
  "browser_project": "none",
  "test_data_snapshot": "e581d99c9711c621dd62c9a5797dcfb550d7fd321b09dbfad2b45927aa46f7f4",
  "runtime_version": "2.0.0-alpha.2",
  "kernel_version": "2.0.0-alpha.2",
  "status": "passed",
  "started_at": "2026-08-11T05:09:28.005Z",
  "completed_at": "2026-08-11T05:09:39.216Z",
  "exit_status": 0,
  "parent_attempt_id": "attempt-20260811050759-348801b49d969b5c"
}
