{
  "schema": "specnav.verification.attempt.v1",
  "id": "attempt-20260812052738-a82d4a101a4040c8",
  "run_id": "run-20260812052738-a82d4a101a4040c8",
  "change_id": "verification-2-0",
  "case_id": "CASE-05",
  "case_snapshot_hash": "5be49e798f6b94dcb4822a608397cf097a336cc73a319dd69aca25549bc48f5a",
  "kind": "regression",
  "sequence": 3,
  "runner": "command",
  "code_sha": "9f3a55aad3203724e09be437f52a89884077cf6b",
  "test_sha": "f465e6926f580652f06af7542378e9f2a93d9afc97199c9f63a4f10af8a90966",
  "scenario_hash": "beefb030833c846a6c7ec39354b360f9222e5d742746082f8050a707c2bac11a",
  "environment_hash": "b50105a3b291fc6ca6ac5740fa47147c990cd9997a069369154d375e671b9f8c",
  "browser_project": "none",
  "test_data_snapshot": "e581d99c9711c621dd62c9a5797dcfb550d7fd321b09dbfad2b45927aa46f7f4",
  "runtime_version": "2.0.0-alpha.2",
  "kernel_version": "2.0.0-alpha.2",
  "status": "passed",
  "started_at": "2026-08-12T05:27:38.529Z",
  "completed_at": "2026-08-12T05:27:53.162Z",
  "exit_status": 0,
  "parent_attempt_id": "attempt-20260812052507-e557a60e7b1e4167"
}
