{
  "schema": "specnav.verification.attempt.v1",
  "id": "attempt-20260809075727-d6bafe880ca6a450",
  "run_id": "run-20260809075727-d6bafe880ca6a450",
  "change_id": "verification-2-0",
  "case_id": "CASE-03",
  "case_snapshot_hash": "5be49e798f6b94dcb4822a608397cf097a336cc73a319dd69aca25549bc48f5a",
  "kind": "initial",
  "sequence": 1,
  "runner": "command",
  "code_sha": "476d43bc52edf52af9088abffccdecaaccd15a10",
  "test_sha": "097e370bf942910b566f472a9c9f9aa673b238c3c39ac819aa2598e7335ccd44",
  "scenario_hash": "8e7047dd6c7368108dae972adc41166db473f0883d2547239555e4710ee7f2f8",
  "environment_hash": "b50105a3b291fc6ca6ac5740fa47147c990cd9997a069369154d375e671b9f8c",
  "browser_project": "none",
  "test_data_snapshot": "2ac84e36c32b1e62a5b419bd091780d43725b2def71a0f2b0c77291ab2ff45af",
  "runtime_version": "2.0.0-alpha.2",
  "kernel_version": "2.0.0-alpha.2",
  "status": "passed",
  "started_at": "2026-08-09T07:57:27.897Z",
  "completed_at": "2026-08-09T08:00:45.175Z",
  "exit_status": 0
}
