{
  "schema": "specnav.verification.attempt.v1",
  "id": "attempt-20260811050759-348801b49d969b5c",
  "run_id": "run-20260811050759-348801b49d969b5c",
  "change_id": "verification-2-0",
  "case_id": "CASE-03",
  "case_snapshot_hash": "5be49e798f6b94dcb4822a608397cf097a336cc73a319dd69aca25549bc48f5a",
  "kind": "retest",
  "sequence": 2,
  "runner": "command",
  "code_sha": "29bd413f06b1989378cb5ae88fbcd101457c086b",
  "test_sha": "2b538baa29378bb226eaab949ab6285059d4e083ff004a1e6bf3ef373b24cb9d",
  "scenario_hash": "8e7047dd6c7368108dae972adc41166db473f0883d2547239555e4710ee7f2f8",
  "environment_hash": "b50105a3b291fc6ca6ac5740fa47147c990cd9997a069369154d375e671b9f8c",
  "browser_project": "none",
  "test_data_snapshot": "2ac84e36c32b1e62a5b419bd091780d43725b2def71a0f2b0c77291ab2ff45af",
  "runtime_version": "2.0.0-alpha.2",
  "kernel_version": "2.0.0-alpha.2",
  "status": "passed",
  "started_at": "2026-08-11T05:07:59.635Z",
  "completed_at": "2026-08-11T05:08:10.698Z",
  "exit_status": 0,
  "parent_attempt_id": "attempt-20260811034955-8ce30ac9436b696c"
}
