{
  "schema": "specnav.verification.attempt.v1",
  "id": "attempt-20260809101321-12f9b3b55f32fa05",
  "run_id": "run-20260809101321-12f9b3b55f32fa05",
  "change_id": "verification-2-0",
  "case_id": "CASE-08",
  "case_snapshot_hash": "5be49e798f6b94dcb4822a608397cf097a336cc73a319dd69aca25549bc48f5a",
  "kind": "regression",
  "sequence": 3,
  "runner": "command",
  "code_sha": "4801eff2cc9f857eabda46cb0e4f02ce16cc03f0",
  "test_sha": "9ee49d6998eaa16a160437def53b7811374a6cc528bfd027cf96e65865e4bea3",
  "scenario_hash": "49a621bc1d798d2b74d3973d703643f0f4fa0cf08337a51dda19a4cbbdbf0e7a",
  "environment_hash": "b50105a3b291fc6ca6ac5740fa47147c990cd9997a069369154d375e671b9f8c",
  "browser_project": "none",
  "test_data_snapshot": "6482f82bc1bedc3583362c7512b13616cc9165039b4d45188590e8c1822abb23",
  "runtime_version": "2.0.0-alpha.2",
  "kernel_version": "2.0.0-alpha.2",
  "status": "passed",
  "started_at": "2026-08-09T10:13:21.961Z",
  "completed_at": "2026-08-09T10:15:52.950Z",
  "exit_status": 0,
  "parent_attempt_id": "attempt-20260809095902-c73dc3a4c9f5bd41"
}
