{
  "schema": "specnav.verification.attempt.v1",
  "id": "attempt-20260809030109-606deddff2fa2e62",
  "run_id": "run-20260809030109-606deddff2fa2e62",
  "change_id": "verification-2-0",
  "case_id": "CASE-06",
  "case_snapshot_hash": "5be49e798f6b94dcb4822a608397cf097a336cc73a319dd69aca25549bc48f5a",
  "kind": "initial",
  "sequence": 1,
  "runner": "command",
  "code_sha": "02b0253161705653b10fdb1a9f8336fd59add313",
  "test_sha": "851f4609a7af3b273600a3a96e4b6a4e1962eb965ef574b531c0f4f788950fe9",
  "scenario_hash": "09cefc234a66db0baebb746678da9b940b28d08b193915c0fd90768ba8ecf2cc",
  "environment_hash": "b50105a3b291fc6ca6ac5740fa47147c990cd9997a069369154d375e671b9f8c",
  "browser_project": "none",
  "test_data_snapshot": "3c3a783b064ce9d806646d53e0708f8df4f1601bb59210047dc2ce56f7e87c78",
  "runtime_version": "2.0.0-alpha.2",
  "kernel_version": "2.0.0-alpha.2",
  "status": "passed",
  "started_at": "2026-08-09T03:01:09.692Z",
  "completed_at": "2026-08-09T03:01:13.779Z",
  "exit_status": 0
}
