{
  "schema": "specnav.verification.attempt.v1",
  "id": "attempt-20260809065321-206f1514abb6b990",
  "run_id": "run-20260809065321-206f1514abb6b990",
  "change_id": "verification-2-0",
  "case_id": "CASE-03",
  "case_snapshot_hash": "5be49e798f6b94dcb4822a608397cf097a336cc73a319dd69aca25549bc48f5a",
  "kind": "retest",
  "sequence": 2,
  "runner": "command",
  "code_sha": "3016019bebbdf85a6d88cf86f992cb22abcbe455",
  "test_sha": "2536b595b2f11cdf2b0667feb6fd3ab72acab2e54be22c445036e6d089f67bc7",
  "scenario_hash": "8e7047dd6c7368108dae972adc41166db473f0883d2547239555e4710ee7f2f8",
  "environment_hash": "b50105a3b291fc6ca6ac5740fa47147c990cd9997a069369154d375e671b9f8c",
  "browser_project": "none",
  "test_data_snapshot": "2ac84e36c32b1e62a5b419bd091780d43725b2def71a0f2b0c77291ab2ff45af",
  "runtime_version": "2.0.0-alpha.2",
  "kernel_version": "2.0.0-alpha.2",
  "status": "failed",
  "started_at": "2026-08-09T06:53:21.292Z",
  "completed_at": "2026-08-09T06:54:12.476Z",
  "exit_status": 128,
  "parent_attempt_id": "attempt-20260806063934-95df9951fe619e21"
}
